{
  "version": 1,
  "route": "B_object_print_artifacts",
  "input": "composition-proof.png",
  "output": "halftone-zones.png",
  "output_scale": 2,
  "screen": {
    "cells_per_short_edge": 840,
    "angle_degrees": 45,
    "supersample": 4,
    "dot_gain": 0.008,
    "max_coverage": 0.68,
    "jitter_fraction": 0.025,
    "ink_load_variation": 0.02,
    "edge_softness_px": 0.22,
    "dot_shape_roughness": 0.035,
    "seed": 731
  },
  "zones": [
    {
      "name": "bounded_photographic_print",
      "polygons": [[[0.09, 0.18], [0.46, 0.15], [0.51, 0.59], [0.13, 0.63]]],
      "exclusions": [],
      "paper_rgb": [220, 214, 199],
      "ink_rgb": [88, 91, 88],
      "black_point": 22,
      "white_point": 238,
      "gamma": 1.5,
      "paper_texture_strength": 0.8,
      "paper_tooth_strength": 0.08,
      "preserve_lighting": 0.0,
      "screen_angle_degrees": 40
    }
  ]
}
